RCS,N2000,N2000_2,Filter,Topic Description,Topic Definition,RCS Concept Type,RCS_2
B:1692,MUFU1,,1,Mutual Funds (NEC) (TRBC level 5),"Companies engaged in providing a type of collective investment scheme that pools money from many investors to buy stocks, bonds, short-term money market instruments, and/or other securities.",Business Sector,
B:1720,AMBLCS,,1,Ambulance & Emergency Services (TRBC level 5),"Companies engaged in providing a vehicle for transportation of sick or injured people to, from or between places of treatment for an illness or injury and in some instances will also provide out of hospital medical care to the patient. Includes also emergency services which ensure public safety and health by addressing different emergencies.",Business Sector,
B:1598,ACCTAX,,1,Accounting & Tax Preparation (TRBC level 5),Companies engaged in providing accounting and tax preparation services for individual clients.,Business Sector,
B:1551,AGCONS,,1,Agricultural Consultancy Services (TRBC level 5),"Companies engaged in providing agricultural consultancy services integrating two or more services in the following: farm mapping, soil and plant analysis, fertilizer recommendations, pest management, weed control, crop residue management, laboratory services, and environmental services.",Business Sector,
B:1548,AGRSS,,1,Agriculture Support Services (TRBC level 5),"Companies engaged in providing agriculture supporting services such as soil preparation, planting, and cultivating services, crop harvesting, postharvest crop activities, farm labor contractors and farm management services.",Business Sector,
B:1741,INTCIR,,1,Integrated Circuits (TRBC level 5),Companies engaged in providing an electronic circuit manufactured by the patterned diffusion of trace elements into the surface of a thin substrate of semiconductor material.,Business Sector,
B:1655,ISLINS,,1,Islamic Insurance (TRBC level 5),"Companies engaged in providing an Islamic insurance concept which is grounded in Islamic muamalat (Islamic banking), observing the rules and regulations of Islamic law. Includes providers of three models: Mudharabah model (profit-sharing), Wakala model and a combination of both.",Business Sector,
B:1801,SOFMOB,,1,Mobile System Software (TRBC level 5),Companies engaged in providing an operating system that controls a mobile device or information appliance.,Business Sector,
B:1764,SERSYS,,1,Servers & Systems (TRBC level 5),"Companies engaged in providing and/or assembling computer servers, such as application servers, web servers, database servers, game servers, proxy servers, file servers, server farms and clusters, among others, together with or without associated operating systems (OS) among servers, such as open source distributions. Includes also providers of mainframes and workstations. Excludes companies that exclusively publish operating systems software (system software that manages software and hardware resources within the system), classified in System Software.",Business Sector,
B:1777,HIFI,,1,Home Audio (TRBC level 5),"Companies engaged in providing any audio electronics intended for home use, such as shelf stereos and surround sound receivers.",Business Sector,
B:1619,BNKPRV,,1,Private Banks (TRBC level 5),"Companies engaged in providing banking, investment and other financial services to private individuals investing sizable assets. These clients are often referred to as high net worth individuals (HNWIs). The private banks usually do not form networks and might provide additional services, such as tax and estate planning, commercial banking, wealth management and foreign exchange services.",Business Sector,
B:1704,MEDIMG,,1,Medical Imaging Systems (TRBC level 5),"Companies engaged in providing body imaging equipment , such as MRI (magnetic resonance imaging), CT (computer tomography), PET (Positron emission tomography), ultrasound devices.",Business Sector,
B:1547,ANIBRE,,1,Animal Breeding (TRBC level 5),Companies engaged in providing breeding services for farm animals as well as pets.,Business Sector,
B:1819,SATSER,,1,Satellite Service Operators (TRBC level 5),"Companies engaged in providing broadband satellite networks and services. Includes a range of broadband networking technologies, solutions, and services.",Business Sector,
B:1807,ECOMMA,,1,E-commerce & Auction Services (TRBC level 5),"Companies engaged in providing buying and selling of products or services over electronic systems such as the Internet and other computer networks. Includes also the process of buying and selling goods or services by offering them up for bid, taking bids, and then selling the item to the highest bidder.",Business Sector,
B:1601,CCFSER,,1,Child Care & Family Services (TRBC level 5),Companies engaged in providing Child Care & Family Services.,Business Sector,
B:1650,CLRSET,,1,"Clearing, Settlement & Custodial Service (TRBC level 5)",Companies engaged in providing clearing and settlement services for securities and commodities traded.,Business Sector,
B:1818,ALTCOM,,1,Alternative Communications Services (TRBC level 5),"Companies engaged in providing communication services such as paging, fax, internet to phone, data & voice business communications, as well as special services used to supplement or replace speech or writing for those with impairments in the production or comprehension of spoken or written language.",Business Sector,
B:1751,NETWEQ,,1,Network Equipment (TRBC level 5),Companies engaged in providing communication solutions to Service Providers like fixed or mobile operators as well as to Enterprise customers.,Business Sector,
B:1766,COHARW,,1,Computer Hardware Component Assembly (TRBC level 5),Companies engaged in providing component devices which are typically installed into or peripheral to a computer case to create a personal computer upon which system software is installed including a firmware interface such as a BIOS and an operating system which supports application software that performs the operator's desired functions.,Business Sector,
B:1809,INSETR,,1,Internet Security & Transactions Services (TRBC level 5),"Companies engaged in providing computer security services related to the Internet. Includes also providers of systems that facilitate and manage transaction-oriented applications, typically for secure data entry and transaction processing.",Business Sector,
B:1798,SOFAPP,,1,Application Software (TRBC level 5),"Companies engaged in providing computer software designed to help the user to perform specific tasks. Includes enterprise software, accounting software, office suites, graphics software and media players.",Business Sector,
B:1660,TRVINS,,1,Travel Insurance (TRBC level 5),"Companies engaged in providing coverage for medical expenses, financial default of travel suppliers, and other losses incurred while traveling.",Business Sector,
B:1791,CPROG,,1,Computer Programming (TRBC level 5),Companies engaged in providing customized software development services. Excludes specialized testing services classified under Testing Services activity.,Business Sector,
B:1790,ITSE1,,1,IT Services & Consulting (NEC) (TRBC level 5),"Companies engaged in providing customized software development, ISP providers, online support services, online database management, interactive data access and auctioning services.",Business Sector,
B:1628,COMLOA,,1,Commercial Loans (TRBC level 5),"Companies engaged in providing debt-based funding arrangements to businesses. Commercial lenders get financing from the wholesale markets (borrowing money from the banks) instead of taking deposits, and are not formed as banks.",Business Sector,
B:1858,BLKTCH,,1,Blockchain Technology (Software) (TRBC level 5),Companies engaged in providing decentralized and distributed digital databases for secure online transactions.,Business Sector,
B:1735,MEDALT,,1,Alternative Medicine (TRBC level 5),"Companies engaged in providing drugs not falling into the category of conventional medicine, such as herbal, homeopathic and traditional Chinese medicine, or Ayurveda pharmaceuticals.",Business Sector,
B:1710,MEDEQ,,1,Medical Equipment (TRBC level 5),"Companies engaged in providing electrical and electronic medical equipment, such as kidney dialysis equipment, glucometers, physiotherapy equipment, laboratory electrical/electronic devices. Excludes diagnostic equipment, such as ECG and EEG equipment, classified in Medical Diagnostic & Testing Equipment; medical imaging systems, such as MRI, PET, CT, ultrasound, classified in Medical Imaging Systems, and laser equipment, classified in Laser Equipment.",Business Sector,
B:1702,MEDMON,,1,Medical Monitoring Systems (TRBC level 5),"Companies engaged in providing electronic medical devices used in constant medical monitoring, such as bedside vital function monitors in hospitals, respiratory monitoring equipment, among others. Excludes medical diagnostic devices (used for immediate and one-stop diagnosis), classified in Medical Diagnostic & Testing Equipment, laser equipment, classified in Laser Equipment, and medical imaging systems, classified in Medical Imaging Systems.",Business Sector,
B:1754,VOIPEQ,,1,VOIP Equipment & Systems (TRBC level 5),"Companies engaged in providing equipment and systems for voice-over-telephone protocol (VOIP) technology, such as telephone systems, VOIP-specific adapters and routers. Excludes providers of VOIP services, classified in VOIP Services.",Business Sector,
B:1713,SPECS,,1,"Glasses, Spectacles & Contact Lenses (TRBC level 5)","Companies engaged in providing eyeglasses, spectacles or specs (informal) used for vision correction. Includes manufacturers of contact lens which are medical devices and can be worn to correct vision. Excludes sunglasses and fashion eyewear, classified in Fashion Eyewear.",Business Sector,
B:1644,VENCAP,,1,Venture Capital (TRBC level 5),"Companies engaged in providing financial capital to early-stage, high-potential, high risk, startup companies. Excludes investors that provide financial capital to private equity companies (unlisted companies or companies that become private as a result of investment), classified in Private Equity.",Business Sector,
B:1242,PRIS1,,1,Professional Information Services (NEC) (TRBC level 5),"Companies engaged in providing financial information, compliance & investor communication services, rating agencies, trade & business publishing, legal, tax, education information providers, journals, as well as news agencies.",Business Sector,
B:1243,FINFP,,1,Financial Information Providers (TRBC level 5),Companies engaged in providing financial information.,Business Sector,
B:1854,CRWDFF,,1,Crowdfinancing & Crowdfunding (TRBC level 5),"Companies engaged in providing funding for a project/venture by raising small contributions from a large number of people, typically via the Internet.",Business Sector,
B:1604,FNRLSS,,1,Funeral Services (TRBC level 5),Companies engaged in providing funeral services.,Business Sector,
B:1810,INTGAM,,1,Internet Gaming (TRBC level 5),Companies engaged in providing games played over some form of computer network. Includes online games that range from simple text based games to games incorporating complex graphics and virtual worlds populated by many players simultaneously.,Business Sector,
B:1215,HRSCON,,1,Human Resources Consulting Services (TRBC level 5),"Companies engaged in providing HR advisory services, such as human capital management consulting, compensation and benefit scheme advice, among others.",Business Sector,
B:295,FINTE,,1,Financial Technology (Fintech) (TRBC level 4),Companies engaged in providing information technologies built to streamline financial services.,Business Sector,
B:1664,HEAINS,,1,Health Insurance (TRBC level 5),Companies engaged in providing insurance against the risk of incurring medical expenses among individuals.,Business Sector,
B:1659,AUTINS,,1,Insurance - Automobile (TRBC level 5),"Companies engaged in providing insurance for cars, trucks, motorcycles, and other road vehicles.",Business Sector,
B:1752,SECSUR,,1,Security & Surveillance (TRBC level 5),"Companies engaged in providing intelligent IP surveillance and security solutions. Includes also development and manufacturing of digital recording systems, video content analysis and control center solutions.",Business Sector,
B:1799,SOFENT,,1,Enterprise Software (TRBC level 5),"Companies engaged in providing is software used in organizations, such as in a business or government. Includes online shopping and online payment processing, interactive product catalogue, automated billing systems, security, content management, IT service management, customer relationship management, resource planning, business intelligence, HR management, manufacturing, application integration, and forms automation.",Business Sector,
B:1599,PSNLEG,,1,Personal Legal Services (TRBC level 5),Companies engaged in providing legal services to individual clients.,Business Sector,
B:1661,CASINS,,1,Casualty Insurance (TRBC level 5),"Companies engaged in providing liability insurance, which is an insurance against claims from third parties, and providing coverage for negligent acts or omissions, for example injuries occurring during working hours in an enterprise. Casualty insurance protects a person or business against legal liability for losses caused by injury to other people or damage to the property of others. Excludes automobile casualty/damage insurance, classified in Insurance - Automobile, property damage insurance, classified in Property Insurance.",Business Sector,
B:1719,RESLTC,,1,Residential & Long-Term Care (TRBC level 5),"Companies engaged in providing long-term care given to adults or children in a residential setting rather than the patient's home, elderly homes and continuing care retirement communities.",Business Sector,
B:1727,HMOS1,,1,Managed Healthcare (NEC) (TRBC level 5),"Companies engaged in providing managed healthcare, mainly operating in the United States.",Business Sector,
B:1785,ELEP1,,1,Electronic Equipment & Parts (NEC) (TRBC level 5),"Companies engaged in providing manufacturing electronic products, such as biometric, and display screen. Includes also companies providing electronic components.",Business Sector,
B:1288,PRTSV1,,1,Marine Port Services (NEC) (TRBC level 5),"Companies engaged in providing marine freight support services such as port loading and unloading, canal, harbor and docking services, longshoreman support, tugboat, navigational control and other related services.",Business Sector,
B:1290,PORTOP,,1,Port Operators (TRBC level 5),"Companies engaged in providing marine freight support services, such as port facility operation; canal, harbor and wharf operation as well as the provision of tugboat, marine salvaging, navigational control and other related services.",Business Sector,
B:1445,MKTCON,,1,Marketing Consulting Services (TRBC level 5),"Companies engaged in providing marketing plans, advices and consultancy to businesses and entities.",Business Sector,
B:1711,MEDDEV,,1,Medical Devices & Implants (TRBC level 5),"Companies engaged in providing medical devices manufactured to replace a missing internal biological structure, support a damaged biological structure, or enhance an existing biological structure. Includes manufacturers of devices used inside of the body, including orthopedic implants, heart valves, artificial pacemakers or cochlear implants. Excludes medical prosthetics and devices that replace external body parts, such as hearing aids, artificial eyes, orthotics, prosthetic limbs and dentures, classified in Medical Prosthetics.",Business Sector,
B:1708,MEDSUP,,1,Medical Supplies (TRBC level 5),"Companies engaged in providing medical supplies, such as medical gloves, medical masks, forceps, surgical knives and devices, bandages and dressings, syringes, stethoscopes, x-ray films, dental drills, veterinarian instruments and other related supplies.",Business Sector,
B:1112,ROCKMN,,1,Rock Mining (TRBC level 5),"Companies engaged in providing mining techniques used to excavate hard minerals, mainly those containing metals, such as ore containing gold, silver, iron, copper, zinc, nickel and lead.",Business Sector,
B:1745,RFIDS,,1,NFC & RFID Systems (TRBC level 5),"Companies engaged in providing near field communication (NFC) and radio frequency identification (RFID) technology devices. RFID uses radio waves to transfer data from an electronic tag, called RFID tag or label, attached to an object, through a reader for the purpose of identifying and tracking the object. NFC enables two electronic devices to establish communication if brought within 4 cm of each other and is used in contactless payment cards, among others.",Business Sector,
B:1701,MEDDTE,,1,Medical Diagnostic & Testing Equipment (TRBC level 5),"Companies engaged in providing non-imaging medical diagnostic equipment, such as ECG (electrocardiography) equipment, EEG (electroencephalography) equipment, advanced laboratory equipment, and pathology specimen locators. Excludes medical imaging systems, such as MRI, PET, CT, ultrasound, classified in Medical Imaging Systems; and laser-based diagnostic devices, classified in Laser Equipment.",Business Sector,
B:1812,WIRTEL,,1,Wired Telecommunications Carriers (TRBC level 5),Companies engaged in providing of direct communication services (such as local calls and long distance national and international.,Business Sector,
B:1432,GTOUR,,1,Guided Tour Operators (TRBC level 5),Companies engaged in providing of tours products with guided services.,Business Sector,
B:1718,HOSPTL,,1,"Hospitals, Clinics & Primary Care Services (TRBC level 5)","Companies engaged in providing patient treatment by specialized staff and equipment, such as hospitals, clinics and outpatient care centers. Includes also the provision of diagnosis, treatment, and prevention of disease, illness, injury, and other physical and mental impairments in humans.",Business Sector,
B:1603,PSNSVC,,1,Personal Care Services (TRBC level 5),"Companies engaged in providing personal care services such as nail bar, beauty salons, hair salons, and massage services.",Business Sector,
B:1600,GENEDS,,1,General Education Services (TRBC level 5),"Companies engaged in providing personal enrichment services such as test preparation, colleges and dance classes.",Business Sector,
B:1640,INVMAN,,1,Investment Management (TRBC level 5),"Companies engaged in providing portfolio management services to corporate clients (businesses, B2B). Includes managers and operators of investment funds, including mutuals, unit trusts, investment trusts, hedge funds, and exchange-traded funds (ETFs), as well as operators of pension funds and life insurance funds. Excludes administrators of funds, providing back-office services to the funds, classified in Collective Investment Fund Operators.",Business Sector,
B:1643,WLTH,,1,Wealth Management (TRBC level 5),"Companies engaged in providing portfolio management services to individual clients (B2C), often high-net-worth individuals.",Business Sector,
B:1725,HOMEHS,,1,Home Healthcare Services (TRBC level 5),"Companies engaged in providing private home care to seniors and/or people who are unable to fully care for themselves/people with physical or mental disabilities. Includes services range from patient home-based companionship, meals to round-the-clock nursing care.",Business Sector,
B:1743,CPUS,,1,Processors (TRBC level 5),"Companies engaged in providing processing unit, which includes Central processing unit (CPU), microprocessor, Graphics processing unit, Physics processing unit, Digital signal processor, Network processor, data processor and audio processors.",Business Sector,
B:1746,SEMQT1,,1,Semiconductor Equipment & Testing (NEC) (TRBC level 5),Companies engaged in providing production of semiconductor testing equipment and semiconductor manufacturing equipment. Includes also companies engaged in semiconductor testing services.,Business Sector,
B:1658,PRPINS,,1,Property Insurance (TRBC level 5),"Companies engaged in providing protection against most risks to property, such as fire, theft and weather damage. Includes providers of insurance such as fire insurance, flood insurance, earthquake insurance, home insurance or boiler insurance. Excludes automobile insurance, classified in Insurance - Automobile, travel insurance, classified in Travel Insurance and casualty insurance, classified in Casualty Insurance.",Business Sector,
B:1245,RAGENS,,1,Rating Agencies (TRBC level 5),Companies engaged in providing rating/evaluation services to Companies and countries in order to give investors insight into the level of risk associated with investing in a particular company/country.,Business Sector,B:243
B:1673,RESV1,,1,Real Estate Services (NEC) (TRBC level 5),"Companies engaged in providing real estate brokerage and agency services, real estate appraisal services, consulting services and management services.",Business Sector,
B:1666,LHRINS,,1,Life & Health Reinsurance (TRBC level 5),Companies engaged in providing reinsurance to life and health insurance Companies.,Business Sector,
B:1667,PCRINS,,1,Property & Casualty Reinsurance (TRBC level 5),Companies engaged in providing reinsurance to property and casualty insurance Companies.,Business Sector,
B:1602,CNSREP,,1,Consumer Repair Services (TRBC level 5),"Companies engaged in providing repair services for consumers goods such as electronics, home appliances, garden equipment, furniture, automobiles and other consumer goods.",Business Sector,
B:1783,SCPREQ,,1,Scientific & Precision Equipment (TRBC level 5),"Companies engaged in providing scientific instruments that are part of laboratory equipment. Includes the integration of computers to improve and simplify control, enhance and extend instrumental functions, conditions, parameter adjustments and data sampling, collection, resolution, analysis (both during and post-process), storage and retrieval.",Business Sector,
B:1678,REID,,1,Diversified REITs (TRBC level 5),Companies engaged in providing securitization of interests related to residential and commercial real estate.,Business Sector,
B:1442,DIGMED,,1,Digital Media Agencies (TRBC level 5),Companies engaged in providing services related to digital media.,Business Sector,
B:1635,BRKSER,,1,Brokerage Services (TRBC level 5),"Companies engaged in providing services which include buying and selling stocks for its clients. Includes companies offering services such as brokerage in equity, debts, warrants, commodities, foreign exchange, swaps, futures and options, and all other exchange, OTC or other bespoke securitised instruments. Includes also execution-only brokerage services. Excludes holding and managing assets on behalf of a client or a company, classified in Wealth Management and Investment Management, respectively.",Business Sector,
B:1291,MARCAR,,1,Marine Cargo Handling Services (TRBC level 5),"Companies engaged in providing ship loading and unloading, docking, stevedoring and longshoreman support services.",Business Sector,
B:1651,FINTEC,,1,Financial Technology & Infrastructure (TRBC level 5),"Companies engaged in providing software and systems for financial community, covering all financial infrastructure, such as for banks, insurance, exchanges, and traders.",Business Sector,B:211
B:1109,COMAPR,,1,Construction Material Processing (TRBC level 5),"Companies engaged in providing stone, lime, construction sand, gravel, brick, asphalt and concrete mixtures, and/or concrete, stone, and structural clay products.",Business Sector,
B:1118,FRSTSS,,1,Forest Support & Services (TRBC level 5),"Companies engaged in providing support activities for forestry, such as estimating timber, forest firefighting, forest pest control, and consulting on wood attributes and reforestation.",Business Sector,
B:1081,MINQ1,,1,Mining Support Services & Equipment (NEC) (TRBC level 5),"Companies engaged in providing support services, on a fee, required for the mining and quarrying of minerals. Includes also equipment manufacturers for mining industry.",Business Sector,
B:1716,DRGDEL,,1,Drug Delivery Systems (TRBC level 5),"Companies engaged in providing systems for administering drugs to achieve a therapeutic effect in humans, such as drip/infusion systems for intravenous drug supply, inhalation equipment. Includes also producers of targeted delivery systems in which the drug is only active in the target area of the body (for example, in cancerous tissues), such as liposomes.",Business Sector,
B:1850,BU2BU,,1,Business to Business (TRBC level 5),"Companies engaged in providing technologies and infrastructure, such as software applications, processes, business models for B2B Internet-based financial transactions/services.",Business Sector,
B:1851,BU2CO,,1,Business to Consumer (TRBC level 5),"Companies engaged in providing technologies and infrastructure, such as software applications, processes, business models for B2C Internet-based financial transactions/services.",Business Sector,
B:1852,CO2CO,,1,Consumer to Consumer (TRBC level 5),"Companies engaged in providing technologies and infrastructure, such as software applications, processes, business models for C2C Internet-based financial transactions/services.",Business Sector,
B:1816,VOIPS,,1,VOIP Services (TRBC level 5),"Companies engaged in providing technologies, methodologies, communication protocols, and transmission techniques for the delivery of voice communications and multimedia sessions over Internet Protocol (IP) networks, such as the Internet. Excludes producers of VOIP equipment/devices, classified in VOIP Equipment & Systems.",Business Sector,
