RCS,N2000,N2000_2,Filter,Topic Description,Topic Definition,RCS Concept Type,RCS_2
M:GZ,ART,,0,Art,"Art including artists, exhibitions, movements and the creative processes involved. Also the sale of individual artworks.",Arts / Culture / Entertainment,M:3
M:H6,THTR,,0,Theater,"Dramatic stage performances and their performances. Includes theater, ballet and opera. Premieres, listings and reviews.",Arts / Culture / Entertainment,M:3
M:M1,BKS,,0,Books,"Literature including books, authors, plotlines, reviews and sales.",Arts / Culture / Entertainment,M:3
M:H1,FLM,,0,Film,"Motion pictures / films, including directors, actors, premieres, reviews and box office.",Arts / Culture / Entertainment,M:3
M:H0,MSIC,,0,Music,Music and musical artists. Includes details and reviews of live performances and recorded music releases.,Arts / Culture / Entertainment,M:3
M:QQ,VGAME,,0,Video Games,"News about the development, production, sales, and use of video games.",Arts / Culture / Entertainment,M:3
M:287,STREAM,,1,Streaming Media,On-demand transmission of audio and video content.,Arts / Culture / Entertainment,
M:3,ENT,,1,Arts / Culture / Entertainment,Performing and non-performing arts; music; theatre; tv; radio; festivals; exhibitions; dance; literature; libraries; museums; painting; sculpture; government policy.,Arts / Culture / Entertainment,M:E7
M:H3,TELE,,1,Television,Television as a medium.,Arts / Culture / Entertainment,M:3
A:8P,AL1,,0,Alabama Municipal Bond Market,Alabama Municipal Bond Market,Asset Class / Property,
A:8Q,AK1,,0,Alaska Municipal Bond Market,Alaska Municipal Bond Market,Asset Class / Property,
A:G1,OPT,,0,Options,All market reports that routinely mention options; all new issues of options; news items concerning forecasts and analyses of the options market; regulation of options markets.,Asset Class / Property,A:7
A:8,MMT,MNEY,0,Money Markets,All money market news; reports about money markets. Trading in all money market instruments. Short-term borrowing and lending between banks.,Asset Class / Property,
A:P,EQB,,0,Equity-Linked Bonds,"All news about equity-linked bonds, including convertible and exchangeable bonds and warrant-bearing bonds.",Asset Class / Property,A:T
A:V,USC,,0,US Corporate Bonds,"All news about U.S. corporate bonds, including issues, forecasts and analysis.",Asset Class / Property,A:T
A:T,CORPD,,0,Corporate Debt / Corporate Debt Financing,"All stories concerning the issuance, pricing, filing and redemption of debt instruments issued by a company. Includes convertible and other equity-linked bonds.",Asset Class / Property,A:U
A:GL,ETPS,,1,Exchange-Traded Products,An Exchange-Traded Product (ETP) is an investment instrument that tracks the performance of an underlying asset or an asset index. ETPs are structured to allow investors to gain exposure to underlying assets without trading futures or taking physical delivery and are especially popular in the commodities market. Also known as Exchange-Traded Vehicles (ETVs).,Asset Class / Property,
A:8R,AZ1,,0,Arizona Municipal Bond Market,Arizona Municipal Bond Market,Asset Class / Property,
A:8S,AR1,,0,Arkansas Municipal Bond Market,Arkansas Municipal Bond Market,Asset Class / Property,
A:2,DBT,,1,Debt / Fixed Income Markets,"Bond and other debt and credit market news, including new issues, yields and other rates, analyses, and market performance. Credit and corporate debt; government, agency, municipal and supranational debt; eurobonds and asset-backed debt.",Asset Class / Property,
A:Z,ILB,,0,Index-Linked Bonds,"Bonds linked to an underlying index, usually inflation.",Asset Class / Property,A:2
A:A,ABS,,0,Asset-Backed Securities,"Bonds or notes that are based on pools of assets, or collateralized by the cash flows from a specified pool of underlying assets.",Asset Class / Property,A:2
A:8T,CA1,,0,California Municipal Bond Market,California Municipal Bond Market,Asset Class / Property,
A:8U,CO1,,0,Colorado Municipal Bond Market,Colorado Municipal Bond Market,Asset Class / Property,
A:8V,CT1,,0,Connecticut Municipal Bond Market,Connecticut Municipal Bond Market,Asset Class / Property,
E:63,AUCT,,1,Sovereign Debt Auctions,"Debt instruments offered by national governments in primary markets, usually by way of an auction, including announcements of planned sales, terms of the debt instruments offered, and auction results.",Asset Class / Property,A:N
A:3Z,CDO,,1,Collateralized Debt Obligations,"Debt securities backed by a pool of bonds, loans and/or other assets.",Asset Class / Property,A:A
A:JL,SUPD,,1,Supranational Agency Debt,"Debt securities issued by international organizations, which transcend established national boundaries or spheres of interest, such as the European Investment Bank, World Bank, IMF and development banks.",Asset Class / Property,A:2
A:8W,DE1,,0,Delaware Municipal Bond Market,Delaware Municipal Bond Market,Asset Class / Property,
A:7,DRV,,0,Derivatives,"Derivatives including futures, options, warrants, spreads, swaps, contracts for differences and other financial instruments that derive their basic value from other instruments and assets traded for cash. New issues of derivatives, forecasts and analyses of a derivatives market, market structure.",Asset Class / Property,
A:8X,DC1,,0,District of Columbia Municipal Bond Market,District of Columbia Municipal Bond Market,Asset Class / Property,
A:9,FRX,,1,Currencies / Foreign Exchange Markets,Exchange rates and analyses of currency markets. Comments on foreign-exchange developments.,Asset Class / Property,
A:8Y,FL1,,0,Florida Municipal Bond Market,Florida Municipal Bond Market,Asset Class / Property,
A:8Z,GA1,,0,Georgia Municipal Bond Market,Georgia Municipal Bond Market,Asset Class / Property,
A:LD,GRNDBT,,0,Green Bonds / Loans,"Green bonds and loans are debt securities aimed at financing 'green', or environment-friendly, projects, that allow investors to gain exposure to lower carbon and more environmentally sustainable assets. Also known as Climate Bonds.",Asset Class / Property,A:2
A:90,GU1,,0,Guam Municipal Bond Market,Guam Municipal Bond Market,Asset Class / Property,
A:91,HI1,,0,Hawaii Municipal Bond Market,Hawaii Municipal Bond Market,Asset Class / Property,
A:92,ID1,,0,Idaho Municipal Bond Market,Idaho Municipal Bond Market,Asset Class / Property,
A:93,IL1,,0,Illinois Municipal Bond Market,Illinois Municipal Bond Market,Asset Class / Property,
A:94,IN1,,0,Indiana Municipal Bond Market,Indiana Municipal Bond Market,Asset Class / Property,
A:G0,SOV,,1,Sovereign Wealth Funds,"Investment policies and changes in investments by state-owned investment funds, which consist of financial assets, including stocks, bonds, property and other investment vehicles.",Asset Class / Property,A:5
A:QG,ETFND,,0,Exchange-Traded Funds,"Investment vehicles that pool money from multiple investors and are managed by professional investment advisors who invest in stocks, bonds, money market instruments, or other assets according to its investment objective. ETFs often track a market index, commodity price or basket of assets like an index fund.",Asset Class / Property,
A:95,IA1,,0,Iowa Municipal Bond Market,Iowa Municipal Bond Market,Asset Class / Property,
A:NL,LEVLOA,,1,Leveraged Loans,"Issuance, syndication, trading of leveraged sub-investment grade loans by banks (or institutional investors) to corporate or institutional borrowers; trends in leveraged loan markets and issuance.",Asset Class / Property,A:E
A:E,LOA,,1,Loans,"Issuance, syndication, trading of loans by banks (or institutional investors) to corporate or institutional borrowers; trends in loan markets and issuance.",Asset Class / Property,A:U
A:96,KS1,,0,Kansas Municipal Bond Market,Kansas Municipal Bond Market,Asset Class / Property,
A:97,KY1,,0,Kentucky Municipal Bond Market,Kentucky Municipal Bond Market,Asset Class / Property,
A:98,LA1,,0,Louisiana Municipal Bond Market,Louisiana Municipal Bond Market,Asset Class / Property,
A:99,ME1,,0,Maine Municipal Bond Market,Maine Municipal Bond Market,Asset Class / Property,
A:9A,MD1,,0,Maryland Municipal Bond Market,Maryland Municipal Bond Market,Asset Class / Property,
A:9B,MA1,,0,Massachusetts Municipal Bond Market,Massachusetts Municipal Bond Market,Asset Class / Property,
A:9C,MI1,,0,Michigan Municipal Bond Market,Michigan Municipal Bond Market,Asset Class / Property,
A:9D,MN1,,0,Minnesota Municipal Bond Market,Minnesota Municipal Bond Market,Asset Class / Property,
A:9E,MS1,,0,Mississippi Municipal Bond Market,Mississippi Municipal Bond Market,Asset Class / Property,
A:9F,MO1,,0,Missouri Municipal Bond Market,Missouri Municipal Bond Market,Asset Class / Property,
A:9G,MT1,,0,Montana Municipal Bond Market,Montana Municipal Bond Market,Asset Class / Property,
A:3X,COVB,,0,Covered Bonds,"Mortgage-backed bonds where underlying collateral remains on the balance sheet, including issuance, pricing, secondary trading and general trends.",Asset Class / Property,A:T
A:D,MTG,,0,Mortgage-Backed Markets,"Mortgage-backed debt and securities, mortgage advances and changes in mortgage rates and conditions.",Asset Class / Property,A:2
A:9J,NE1,,0,Nebraska Municipal Bond Market,Nebraska Municipal Bond Market,Asset Class / Property,
A:9K,NV1,,0,Nevada Municipal Bond Market,Nevada Municipal Bond Market,Asset Class / Property,
A:S,EUB,,0,Eurobonds,"New eurobond issues in Europe; including issues by foreign borrowers in domestic markets where there is no eurobond market e.g. Swiss francs. Exclude corporate or domestic government bonds, e.g. gilts, Bunds, Samurais & Yankees.",Asset Class / Property,A:2
A:9L,NH1,,0,New Hampshire Municipal Bond Market,New Hampshire Municipal Bond Market,Asset Class / Property,
A:9M,NJ1,,0,New Jersey Municipal Bond Market,New Jersey Municipal Bond Market,Asset Class / Property,
A:9N,NM1,,0,New Mexico Municipal Bond Market,New Mexico Municipal Bond Market,Asset Class / Property,
A:9P,NY1,,0,New York Municipal Bond Market,New York Municipal Bond Market,Asset Class / Property,
A:R,MUNI,,0,Municipal Debt,"News about all local, state and sub-national bond and debt issuance markets. Includes state, local authority, local agency and general obligation bonds. Municipal bonds.",Asset Class / Property,A:2
A:N,GVD,,1,National Government Debt,"News about all national government bond and debt instrument markets. Includes treasury gilts, bonds and notes (not T-bills, which are money market instruments).",Asset Class / Property,A:2
A:87,BQ1,,1,Bank Qualified,"News about bank-qualified bonds, which allow banks to deduct interest paid to carry those bonds.  Bank-qualified bonds are typically issued for a public purpose in small amounts.",Asset Class / Property,E:5I
M:GX,TNC,,0,Terms / Conditions,"News about bond terms and conditions, including issuer name, coupon type and rate, maturity date and other features.",Asset Class / Property,A:2
A:85,GOS,,1,General Obligation Debt,News about general obligation debt issued by state and local government entities; GO notes and taxable GO debt; general obligation certificates of participation; state appropriation debt; and news about new GO financings and new capital programs.,Asset Class / Property,
A:86,REVS,,1,Revenue Bonds,"News about revenue bonds, issued by state, local authority and agency entities, that finance income-producing projects and are secured by a specified revenue source.",Asset Class / Property,
A:C,HOT,,0,Volatile Shares / Hot Stocks,News about sharp changes in the price of a share or prices of several shares in the same market sector.,Asset Class / Property,A:1
M:GW,BINS,,0,Municipal Debt Credit Enhancement,"News about sub-national, local government credit enhancement, such as bond insurance and letters of credit and the companies that provide these products.",Asset Class / Property,A:R
A:88,TA1,,1,Taxables,"News about taxable bonds, which are issued for purposes the federal government deems does not provide a significant benefit to the public.",Asset Class / Property,E:5I
A:2T,NDFW,,1,Non-Deliverable Forwards,"Non-Deliverable Forwards, Non-Deliverable Forward Outrights and NDF Spreads.",Asset Class / Property,A:9
A:9H,NC1,,0,North Carolina Municipal Bond Market,North Carolina Municipal Bond Market,Asset Class / Property,
A:9I,ND1,,0,North Dakota Municipal Bond Market,North Dakota Municipal Bond Market,Asset Class / Property,
A:9Q,OH1,,0,Ohio Municipal Bond Market,Ohio Municipal Bond Market,Asset Class / Property,
A:9R,OK1,,0,Oklahoma Municipal Bond Market,Oklahoma Municipal Bond Market,Asset Class / Property,
A:9S,OR1,,0,Oregon Municipal Bond Market,Oregon Municipal Bond Market,Asset Class / Property,
A:9T,PA1,,0,Pennsylvania Municipal Bond Market,Pennsylvania Municipal Bond Market,Asset Class / Property,
A:4,COM,CDTY,1,Commodities Markets,"Production, consumption and trading in primary commodities markets, including agricultural, energy, metals and diamonds. Also includes weather and shipping news affecting commodities markets.",Asset Class / Property,
A:9U,PR1,,0,Puerto Rico Municipal Bond Market,Puerto Rico Municipal Bond Market,Asset Class / Property,
A:6,REAM,,1,Real Estate Markets,"Real estate investments including REITs, private property funds, Islamic finance and the public sector. Including property returns and forecasts, housing data, land prices, mortgage-backed bond issues. Property deals such as building transactions or corporate sales and leasebacks. Property related government initiatives, regulatory issues, and the launch and performance of property investment products or sector indexes. Also major infrastructure projects.",Asset Class / Property,
A:9V,RI1,,0,Rhode Island Municipal Bond Market,Rhode Island Municipal Bond Market,Asset Class / Property,
A:1,STX,,1,Equities Markets,"Share market trading news, including the performance of share market indexes and individual shares.",Asset Class / Property,
A:JM,MTNOT,,1,Short / Medium Term Notes,"Short and medium-term debt securities issued by government and non-government entities. Debt typically with a term of 5-10 years, although a full range of maturities - from less than one year to as long as 100 years - and amounts are available, with more or less conventional features incorporated such as fixed or floating coupon basis.",Asset Class / Property,A:2
A:9W,SC1,,0,South Carolina Municipal Bond Market,South Carolina Municipal Bond Market,Asset Class / Property,
A:9X,SD1,,0,South Dakota Municipal Bond Market,South Dakota Municipal Bond Market,Asset Class / Property,
A:I,SUK,,1,Sukuk,"Sukuk debt, typically defined as Islamic bonds or debt instruments that adhere to sharia (Islamic law).",Asset Class / Property,M:M4
A:9Y,TN1,,0,Tennessee Municipal Bond Market,Tennessee Municipal Bond Market,Asset Class / Property,
A:9Z,TX1,,0,Texas Municipal Bond Market,Texas Municipal Bond Market,Asset Class / Property,
A:U,CDM,,1,Credit Markets,"The issuance, pricing and trading of corporate debt securities, credit default swaps (CDS) and loans.",Asset Class / Property,A:2
A:G,CDV,,1,Credit Default Swaps,"The issuance, pricing and trading of Credit Default Swaps, or any financial swap arrangement under which the seller of the CDS will compensate the buyer in the event of a loan default or other defined credit event.",Asset Class / Property,A:U
A:X,HYD,,1,High-Yield Securities,"The issuance, pricing and trading of debt securities that carry a relatively high risk of default and thus pay a relatively high yield, also sometimes known as junk bonds.",Asset Class / Property,
A:Y,IGD,,1,Investment Grade Securities,"The issuance, pricing and trading of debt securities that carry a relatively low risk of default and thus pay a relatively low yield.",Asset Class / Property,
A:W,AGN,,1,Agency Debt,"The issuance, pricing and trading of debt securities, usually in the form of bonds, issued by government agencies.",Asset Class / Property,A:2
A:BV,ILS,,1,Insurance-Linked Securities,"The issuance, pricing and trading of financial instruments whose values are driven by insurance loss events.",Asset Class / Property,A:2
A:5,FUND,,1,Funds,"The views, forecasts, strategies and market actions of fund operators and other significant groups and classes of investors and traders with regard to capital flows across and within asset markets. Includes news about market performance of any and all types of funds including influential single-party traders and significant asset allocation decisions and views.",Asset Class / Property,
A:1M,CMBS,,1,Commercial Mortgage-Backed Securities,Types of mortgage-backed security backed by mortgages on commercial rather than residential real estate.,Asset Class / Property,A:D
A:3V,RMBSE,,1,Residential Mortgage-Backed Securities,Types of mortgage-backed security backed by mortgages on residential rather than commercial real estate.,Asset Class / Property,A:D
A:A0,UT1,,0,Utah Municipal Bond Market,Utah Municipal Bond Market,Asset Class / Property,
A:A1,VT1,,0,Vermont Municipal Bond Market,Vermont Municipal Bond Market,Asset Class / Property,
A:A3,VI1,,0,Virgin Islands Municipal Bond Market,Virgin Islands Municipal Bond Market,Asset Class / Property,
A:A2,VA1,,0,Virginia Municipal Bond Market,Virginia Municipal Bond Market,Asset Class / Property,
A:A4,WA1,,0,Washington Municipal Bond Market,Washington Municipal Bond Market,Asset Class / Property,
A:A5,WV1,,0,West Virginia Municipal Bond Market,West Virginia Municipal Bond Market,Asset Class / Property,
A:A6,WI1,,0,Wisconsin Municipal Bond Market,Wisconsin Municipal Bond Market,Asset Class / Property,
A:A7,WY1,,0,Wyoming Municipal Bond Market,Wyoming Municipal Bond Market,Asset Class / Property,
M:282,P2PP,,1,Peer-to-Peer Economy,A decentralized transactions model with individuals interacting to buy or sell goods and services directly with each other without an intermediary third-party.,Broad News Topic,
M:28H,CLC,,1,Climate Change,All news coverage associated with the broader topic of climate change.,Broad News Topic,M:H
M:E7,GEN,,1,General News,"All news that is not primarily financial, business or sports.",Broad News Topic,
M:JS,SPAC,,2,Space Exploration,"Astronomy / space exploration including new research into celestial objects, space, and the physical universe.  Also spaceflights of manned and unmanned vehicles.",Broad News Topic,M:V
M:1SI,BLKCHN,,2,Blockchain,"Blockchain, or distributed ledger technology, is a transaction processing and settlement system where information about a transaction or an asset can be cryptographically digitized, stored and securely shared through a peer-to-peer network, allowing participants to transact without intermediaries while maintaining a secure encrypted audit trail.",Broad News Topic,M:NL
M:27M,DIGPAY,,0,Digital Payment,Cashless payments made electronically.,Broad News Topic,
M:Z,CMPNY,,0,Company News,Company news (added automatically when a story contains any company RIC).,Broad News Topic,
M:ES,CLJ,,1,Crime / Law / Justice,"Crime, law and justice.",Broad News Topic,M:E7
M:2F7,STAENG,,1,Stakeholder Engagement,"Engaging with stakeholders (e.g. customers, employees, investors, suppliers, communities, governments) to foster trust, confidence and buy-in.",Broad News Topic,
M:27P,IOFT,,2,Internet of Things,Everyday physical objects connected to the Internet communicating without human involvement.,Broad News Topic,
M:27G,BIGDT,,1,Big Data,"Huge volumes of data used to extract insight (e.g. trends, patterns).",Broad News Topic,
M:2EX,CIRECO,,1,Circular Economy,"In contrast to a ""take-make-waste"" linear model, a circular economy minimizes waste and pollution by employing tactics like reuse, sharing, refurbishment and recycling.",Broad News Topic,
M:27K,DABR,,2,Data Breach,Incident that exposes confidential information.,Broad News Topic,
M:1QF,MIFID2,,1,MiFID II,"MiFID II is a revision of the Markets in Financial Instruments Directive (MiFID), the European Union (EU) legislation that came into force in November 2007, that provides harmonised regulation for investment services across the 31 member states of the European Economic Area (EEA), through the regulation of investment intermediaries that provide services to clients linked to financial instruments, and the venues where those instruments are traded. It is being revised to improve the functioning of financial markets in light of the financial crisis and to strengthen investor protection. MiFID II extends the number of financial instruments covered by trading rules and ensures that trading takes place on regulated platforms, introduces rules on high frequency trading, improves the transparency and oversight of financial markets - including derivatives markets - and addresses the issue of price volatility in commodity derivatives. The new framework improves conditions for competition in the trading and clearing of financial instruments. The new legislation includes a revised MiFID and a new Markets in Financial Instruments Regulation (MiFIR), and is currently set to take effect from January 2018.",Broad News Topic,
M:1P4,COMARB,,1,Commodity Arbitrage,"News about commodity arbitrage, ie the practice of taking advantage of a price difference between two or more markets: striking a combination of matching deals that capitalize upon the imbalance, the profit being the difference between the market prices minus any transportation or transfer costs.",Broad News Topic,A:4
M:38,PRO,,0,Personalities / People,News and profiles focused on the life or major moments in the life of individuals.,Broad News Topic,
M:27C,ALTDT,,1,Alternative Data,Non-traditional data which can provide investment insight.,Broad News Topic,
M:8,CEN,,1,Central Banks / Central Bank Events,"Policies of and changes at any central bank, reserve bank, or monetary authority.",Broad News Topic,
M:2DY,PRIVT,,0,Private Company News,Private company news (added automatically to stories that discuss a private company).,Broad News Topic,
M:2DZ,PUBL,,0,Public Company News,Public company news (added automatically to stories that discuss a public company).,Broad News Topic,
M:27R,MARSX,,2,Mars Exploration,"Research, plans and advancements related to exploration of Mars.",Broad News Topic,
M:281,MOONX,,2,Moon Exploration,"Research, plans and advancements related to exploration of the Moon.",Broad News Topic,
M:2CJ,INFRA,,1,Infrastructure,"Stories about infrastructure projects and deals including deal structure, finance, offtake agreements, risk profile, regulatory compliance and lender, investor and advisor profiles.",Broad News Topic,
B:58,CPAFR,,1,"Courier, Postal, Air Freight & Land-based Logistics (TRBC level 4)","Air cargo and mail carriers, packaging and logistic air freight services, courier and postal delivery services, as well as land-based logistics and courier services.",Business Sector,B:244
B:169,HARW,,1,Computer Hardware (TRBC level 4),"Assemblers, manufacturers and wholesalers of computers, computer hardware and computer peripherals. Includes producers of scientific and super computers, tablet and netbook computers, input devices, computer peripherals, servers and systems, storage devices, consumer document management equipment, as well as ATM machines.",Business Sector,B:282
B:1638,BNKMER,,1,Merchant Banks (TRBC level 5),"Banks engaged mostly in (but is not limited to) international finance, long-term loans for Companies and underwriting. Merchant banks do not provide regular banking services to the general public. The distinction between an investment bank and a merchant bank is that a merchant bank invests its own capital in a client company whereas an investment bank purely distributes (and trades) the securities of that company.",Business Sector,
B:108,BEVS,,1,Beverages (TRBC level 3),"Brewers, distillers, producers and distributors of beer and malt liquor, wine and distilled liquors, as well as non-alcoholic beverages including water, fruit drinks, sodas and other flavored beverages.",Business Sector,B:107
B:241,COEN,,1,Construction & Engineering (TRBC level 4),"Builders and engineers that undertake commercial building, civil engineering, utility and other industrial plant construction projects. Includes builders of transport infrastructure, dam and water works as well as hotel, and office buildings. Includes also manufacturers of heavy machinery for permanent installation.",Business Sector,
B:197,HSEBLD,,1,Homebuilding & Construction Supplies (TRBC level 3),"Builders of residential homes, mobile homes and prefabricated homes, and manufacturers of value-added building products and home improvement components.",Business Sector,B:256
B:77,HOME,,1,Homebuilding (TRBC level 4),"Builders of residential homes, mobile homes and prefabricated homes. Includes centralized homebuilding operators where work is channeled to specialized contractors.",Business Sector,B:197
B:238,SHPB,,1,Shipbuilding (TRBC level 4),"Builders of ships, ship parts and ship related repair services.",Business Sector,
M:MT,SBIZ,,1,Sports Business,"Business and economic aspects of sport, and sports stories, with a cross-asset appeal to financial clients. Includes all financial aspects of sport, the selling or sponsorship of sport, stadium construction and organisation of major events such as the Olympic Games and Soccer World Cup. Also includes large changes in share ownership of publicly owned sports teams and the issuing of bonds.",Business Sector,M:W
M:1P2,TMT,,1,Technology / Media / Telecoms,"Companies active in the technology, media or telecommunications industries.",Business Sector,
B:1625,CREDUN,,1,Credit Unions (TRBC level 5),Companies engaged in accepting members' share deposits in cooperatives that are organized to offer consumer loans to their members.,Business Sector,
